{
	"$schema": "board.schema.json",
	"image": {
		"src": "boards/board1.png",
		"size": [400,300]
	},
	"stations": [
		[[-75,60],[1,4],[1,3],[2]],
		[[-200,65],[0,4],[0],[3]],
		[[-75,285],[3],[4],[0]],
		[[-200,290],[2,4],[0],[1]],
		[[-130,180],[0,1,3],[2]]
	],
	"tickets": [
		[10,4,4,1,2],
		[8,8,8,0,0]
	],
	"turnCount": 30,
	"visibleTurns": [3,7,10],
	"startLocations": [0,1,2,3,4]
}